leelaZero/win/leela-zero-0.17-win64/leelaz_opencl_tuning
1;XgemmBatched;256;125;256;36; -DKWG=16 -DKWI=8 -DMDIMA=16 -DMDIMC=16 -DMWG=64 -DNDIMB=8 -DNDIMC=8 -DNWG=64 -DSA=1 -DSB=1 -DSTRM=0 -DSTRN=0 -DTCE=0 -DVWM=4 -DVWN=2;OpenCL: NVIDIA Corporation NVIDIA GeForce GTX 1050 Ti @ 1392MHz
1;XgemmBatchedHalf;256;125;256;36; -DKWG=32 -DKWI=8 -DMDIMA=8 -DMDIMC=8 -DMWG=64 -DNDIMB=16 -DNDIMC=16 -DNWG=64 -DSA=1 -DSB=1 -DSTRM=0 -DSTRN=0 -DTCE=0 -DVWM=4 -DVWN=2;OpenCL: NVIDIA Corporation NVIDIA GeForce GTX 1050 Ti @ 1392MHz
